{
  "$schema": "../schemas/dataset-v1.schema.json",
  "format": "drop7-dataset-v1",
  "datasetId": "DS-20260820-afterstate-h40-k8-3f2f6d29",
  "title": "Action-complete H40 afterstate corpus, K=8 aligned scenarios, phase-greedy D1 continuation (pilot iteration 1)",
  "dataRole": "public-development",
  "informationClass": "public-only",
  "originUnit": "whole-game",
  "originCount": 256,
  "rowCount": 616048,
  "wholeOriginSplit": true,
  "seedLeaseRefs": [
    "SL-20260820T083000Z-5da70000"
  ],
  "parentDatasetRefs": [],
  "fields": [
    "originSeed (provenance/fold only, never a model input)",
    "moveIndex (provenance only)",
    "fold (train/calibration/heldout by whole origin game)",
    "rootBoard/rootNextDisc/rootMovesRemaining (canonical public root)",
    "action (canonical column)",
    "scenario (aligned scenario index, common random numbers across siblings)",
    "afterstateBoard/afterstateNextDisc/afterstateMovesRemaining (canonical public afterstate; the only model inputs)",
    "terminal, scoreGained, movesSurvived, clears, reveals, maxChain (labels)"
  ],
  "privilegedFields": [
    "originSeed",
    "moveIndex"
  ],
  "allowedConsumers": [
    "afterstate-ranker training and offline ranking evaluation"
  ],
  "artifact": {
    "path": "runs/RUN-20260820T082542Z-7866d15c/corpus/corpus.ndjson",
    "sha256": "3761971d35358fd1964c5e0682ec7c18f7c815cd78cf23aad65c6064284a8ea6",
    "bytes": 257639491
  },
  "createdAt": "2026-08-20T09:00:00Z"
}
